date,title,source,url
2026-05-16,Costco just got its dream economy,TheStreet,https://www.thestreet.com/retail/costco-just-got-its-dream-economy
2026-05-14,Trump tariff refund checks begin disbursing this week — who qualifies and why are millions excluded from payouts?,The Times of India,https://economictimes.indiatimes.com/news/international/us/trump-tariff-refund-checks-begin-disbursing-this-week-who-qualifies-and-why-are-millions-excluded-from-payouts/articleshow/131093826.cms
2026-05-13,"How to save on gas: These memberships, credit cards and driving habits cut costs",NBC News,https://www.nbcnews.com/select/shopping/how-to-save-on-gas-rcna344978
2026-05-11,Budget-conscious shoppers are feeding a boom in discount groceries,NPR,https://www.npr.org/2026/05/11/nx-s1-5716202/discount-groceries-aldi-food-affordability
2026-05-10,Walmart vs Costco 2026: Which Retail Giant Is the Better Buy for Investors Now,Ibtimes.com.au,https://www.ibtimes.com.au/walmart-vs-costco-2026-which-retail-giant-better-buy-investors-now-1868492
2026-05-09,Costco Stock Is Benefiting from a Jump in April Sales. It Can Thank the Strait of Hormuz.,Barchart.com,https://www.barchart.com/story/news/1827478/costco-stock-is-benefiting-from-a-jump-in-april-sales-it-can-thank-the-strait-of-hormuz
2026-05-08,"Walmart Stock a Strong Buy in 2026 as E-Commerce Surge, Market Share Gains and Analyst Optimism Drive Upside",Ibtimes.com.au,https://www.ibtimes.com.au/walmart-stock-strong-buy-2026-e-commerce-surge-market-share-gains-analyst-optimism-drive-upside-1868408
2026-05-06,"Walmart, Costco poised to win amid unfavorable retail environment",Retail Dive,https://www.retaildive.com/news/walmart-costco-winners-unfavorable-retail-environment/819424/
2026-05-06,Elanco Animal Health Reports First Quarter 2026 Results,PRNewswire,https://www.prnewswire.com/news-releases/elanco-animal-health-reports-first-quarter-2026-results-302763339.html
2026-05-05,Costco Stock in 2026: Strong Buy for Long-Term Investors Despite Premium Valuation,Ibtimes.com.au,https://www.ibtimes.com.au/costco-stock-2026-strong-buy-long-term-investors-despite-premium-valuation-1868236
2026-05-04,Walmart Costco Self-Checkout Overhaul: Why Big Retailers Are Ditching Machines Amid Theft & Frustration,Ibtimes.com.au,https://www.ibtimes.com.au/walmart-costco-self-checkout-overhaul-why-big-retailers-are-ditching-machines-amid-theft-1868174
2026-05-03,Walmart Dollar General Costco Rethink Self-Checkout Amid Theft Surge and New State Laws,Ibtimes.com.au,https://www.ibtimes.com.au/walmart-dollar-general-costco-rethink-self-checkout-amid-theft-surge-new-state-laws-1868079
2026-04-29,Costco's iconic hot dog and soda combo just got more options for the first time in 40 years,Dailymail.com,https://www.dailymail.com/yourmoney/article-15775963/costco-hot-dog-soda-combo-options-years.html
2026-04-28,"Tariff refunds 2026: Will FedEx, UPS, Costco cut prices or keep savings? Why shoppers may see no price drop",The Times of India,https://economictimes.indiatimes.com/news/international/us/tariff-refunds-2026-will-fedex-ups-costco-cut-prices-or-keep-savings-why-shoppers-may-see-no-price-drop/articleshow/130581492.cms
2026-04-20,Will Americans Keep Paying a ‘Tariff Tax’?,The American Prospect,http://prospect.org/2026/04/20/will-americans-keep-paying-tariff-tax/
2026-04-17,Is Walmart Down? Online Shopping Disruptions Hit Millions as Retail Giant Faces Intermittent Outages,Ibtimes.com.au,https://www.ibtimes.com.au/walmart-down-online-shopping-disruptions-hit-millions-retail-giant-faces-intermittent-outages-1866846
2026-04-13,Americans are more frustrated with the economy than ever and sky-high gas prices could be a big reason why,Business Insider,https://www.businessinsider.com/gas-prices-shape-americans-feelings-economy-2026-4
2026-04-13,Costco’s prices are over 20% cheaper than Walmart’s according to Consumer Reports,Celebitchy.com,https://www.celebitchy.com/971319/costcos_prices_are_over_20_cheaper_than_walmarts_according_to_consumer_reports/
2026-04-13,"Singapore retail investors make bets on dips and rallies amid Iran war, data shows",The Straits Times,https://www.straitstimes.com/business/invest/singapore-retail-investors-make-bets-on-dips-and-rallies-amid-iran-war-data-shows
2026-04-11,Tariff Refunds Flow to Companies as Consumers Keep Footing the Bill,Capitalandmain.com,https://capitalandmain.com/will-americans-keep-paying-a-tariff-tax
2026-04-08,Costco Wholesale Corporation Reports March Sales Results,GlobeNewswire,https://www.globenewswire.com/news-release/2026/04/08/3270521/0/en/Costco-Wholesale-Corporation-Reports-March-Sales-Results.html
2026-04-08,How Costco Won in Japan,Readtrung.com,https://www.readtrung.com/p/how-costco-won-in-japan
2026-04-08,"Gold and silver price today, Wednesday, April 8: Prices rise after announcement of U.S.-Iran ceasefire",Yahoo Entertainment,https://finance.yahoo.com/personal-finance/investing/article/gold-and-silver-price-today-wednesday-april-8-prices-rise-after-announcement-of-us-iran-ceasefire-110829477.html
2026-05-16,Costco just got its dream economy,TheStreet,https://www.thestreet.com/retail/costco-just-got-its-dream-economy
2026-05-14,Trump tariff refund checks begin disbursing this week — who qualifies and why are millions excluded from payouts?,The Times of India,https://economictimes.indiatimes.com/news/international/us/trump-tariff-refund-checks-begin-disbursing-this-week-who-qualifies-and-why-are-millions-excluded-from-payouts/articleshow/131093826.cms
2026-05-13,"How to save on gas: These memberships, credit cards and driving habits cut costs",NBC News,https://www.nbcnews.com/select/shopping/how-to-save-on-gas-rcna344978
2026-05-11,Budget-conscious shoppers are feeding a boom in discount groceries,NPR,https://www.npr.org/2026/05/11/nx-s1-5716202/discount-groceries-aldi-food-affordability
2026-05-10,Walmart vs Costco 2026: Which Retail Giant Is the Better Buy for Investors Now,Ibtimes.com.au,https://www.ibtimes.com.au/walmart-vs-costco-2026-which-retail-giant-better-buy-investors-now-1868492
2026-05-09,Costco Stock Is Benefiting from a Jump in April Sales. It Can Thank the Strait of Hormuz.,Barchart.com,https://www.barchart.com/story/news/1827478/costco-stock-is-benefiting-from-a-jump-in-april-sales-it-can-thank-the-strait-of-hormuz
2026-05-08,"Walmart Stock a Strong Buy in 2026 as E-Commerce Surge, Market Share Gains and Analyst Optimism Drive Upside",Ibtimes.com.au,https://www.ibtimes.com.au/walmart-stock-strong-buy-2026-e-commerce-surge-market-share-gains-analyst-optimism-drive-upside-1868408
